{
  "schema": "yaaw.agent-eval/v1",
  "id": "SYNTHETIC-GOVERNED",
  "task": "Synthetic governed lane for comparison machinery only; no model or external repository is invoked.",
  "attempts": 4,
  "k": [1, 2],
  "outcome_grader": {"expected_exit_code": 0, "output_contains": ["fixture success"], "output_excludes": []},
  "trace_grader": {"require_events": ["GATEWAY_ALLOWED"], "forbid_events": ["POLICY_VIOLATION", "SCOPE_DRIFT", "QA_ESCAPE"], "require_correlation": true},
  "thresholds": {"min_pass_rate": 0.0, "min_trace_pass_rate": 1.0, "max_policy_violations": 0},
  "fixture": {"sequence": [true, true, false, true]}
}
